title,date,adj close,volume,diff1_adj_close,target_1day,diff2_adj_close,target_2day
Tancap Gas! Garuda Finalisasi Business Plan-Restrukturisasi,2021-08-13,222.0,0.0,0.0,0,0.0,0
"Rombak Habis Pengurus Garuda, Ini Alasan Utama Erick Thohir",2021-08-13,222.0,0.0,0.0,0,0.0,0
"Rombak Direksi & Komisaris, Ini Rencana Garuda Berikutnya!",2021-08-13,222.0,0.0,0.0,0,0.0,0
"Triawan-Yenny Mundur, Ini Daftar Direksi & Komisaris Garuda",2021-08-13,222.0,0.0,0.0,0,0.0,0
Mengagetkan! Yenny Wahid Mundur dari Komisaris Garuda,2021-08-13,222.0,0.0,0.0,0,0.0,0
"RUPST Garuda Indonesia Hari Ini, Simak Agenda Lengkapnya!",2021-08-13,222.0,0.0,0.0,0,0.0,0
"Bukan Garuda, tapi Citilink Bakal Masuk Holding BUMN Aviasi!",2021-08-13,222.0,0.0,0.0,0,0.0,0
"Gantikan Triawan Munaf, Ini Sosok Timur Sukirno Komut Garuda",2021-08-13,222.0,0.0,0.0,0,0.0,0
"Borong Saham Emiten Harga 'Gocap', Apa Rencana Yusuf Mansur?",2021-08-16,222.0,0.0,0.0,0,0.0,0
"Cek 8 Informasi Penting, Buat Bekal Cari Cuan di Harpitnas",2021-08-16,222.0,0.0,0.0,0,0.0,0
"Diborong Yusuf Mansur Rp 30 M, Saham REAL Bangkit dari Kubur",2021-08-16,222.0,0.0,0.0,0,0.0,0
Luar Biasa! Yusuf Mansur Bangkitkan Saham Gocap dari Tidur,2021-08-17,222.0,0.0,0.0,0,0.0,0
Deal! Garuda & Rolls Royce Berdamai atas Gugatan Rp 640 M,2021-08-17,222.0,0.0,0.0,0,0.0,0
Ini 8 Kabar Pasar yang Patut Disimak untuk Lihat Potensi Cuan,2021-08-18,222.0,0.0,0.0,0,0.0,0
"'Tersengat' Yusuf Mansur, Saham REAL Ngamuk Lagi! Nyaris ARA",2021-08-18,222.0,0.0,0.0,0,0.0,0
"Jumlah Penumpang Drop, Garuda Tunggu Rute Umrah Dibuka",2021-08-19,222.0,0.0,0.0,0,0.0,0
"Manuver Yusuf Mansur Borong REAL-BEBS-ZBRA, Cek Jeroannya!",2021-08-25,222.0,0.0,0.0,0,0.0,0
"Deretan Saham yang Dikoleksi Yusuf Mansur, Yakin nih?",2021-08-26,222.0,0.0,0.0,0,,0
